{
  "$schema": "../../../schemas/fingerprint.schema.json",
  "family_id": "unattributed-c30f704fd4f93148ad422152d7f71926",
  "id": "fp_1f242c683362332d6e30982894c1e69a",
  "quality": {
    "independent_signal_count": 2,
    "independent_signal_types": [
      "field_keys",
      "filenames"
    ],
    "yara_eligible": false
  },
  "schema_version": "1.0",
  "scope": "exported_log_format",
  "sharing": "TLP:CLEAR",
  "signature": {
    "banner_strings": [],
    "field_keys": [
      "computer",
      "country",
      "cpu",
      "gpu",
      "ip",
      "os",
      "ram",
      "user"
    ],
    "filenames": [
      "system.txt"
    ],
    "panel_brand": null
  },
  "status": "active"
}
