{
  "$schema": "../../../schemas/fingerprint.schema.json",
  "family_id": "unattributed-cc9ea5e78f04d5b5388697a8ae237bda",
  "id": "fp_c6146c03a9b29dd8130a8653559622a0",
  "quality": {
    "independent_signal_count": 2,
    "independent_signal_types": [
      "field_keys",
      "filenames"
    ],
    "yara_eligible": false
  },
  "schema_version": "1.0",
  "scope": "exported_log_format",
  "sharing": "TLP:CLEAR",
  "signature": {
    "banner_strings": [],
    "field_keys": [
      "city",
      "country",
      "cpu",
      "gpu",
      "hwid",
      "ip",
      "keyboard",
      "os product",
      "ram",
      "system language",
      "timezone"
    ],
    "filenames": [
      "system.txt",
      "userinformation.txt"
    ],
    "panel_brand": null
  },
  "status": "active"
}
