{
  "$schema": "../../../schemas/fingerprint.schema.json",
  "family_id": "mac-sync",
  "id": "fp_52c2a7fe75372374992c61619f5d9f4d",
  "quality": {
    "independent_signal_count": 3,
    "independent_signal_types": [
      "marker",
      "field_keys",
      "filenames"
    ],
    "yara_eligible": true
  },
  "schema_version": "1.0",
  "scope": "exported_log_format",
  "sharing": "TLP:CLEAR",
  "signature": {
    "banner_strings": [],
    "field_keys": [
      "build tag",
      "graphics/displays",
      "hardware",
      "password",
      "software"
    ],
    "filenames": [
      "information.txt"
    ],
    "panel_brand": "MacSync Stealer"
  },
  "status": "active"
}
