{
  "$schema": "../../../schemas/fingerprint.schema.json",
  "family_id": "stealerium",
  "id": "fp_4ffd420074138e109d342769a677f0bd",
  "quality": {
    "independent_signal_count": 2,
    "independent_signal_types": [
      "field_keys",
      "filenames"
    ],
    "yara_eligible": false
  },
  "schema_version": "1.0",
  "scope": "exported_log_format",
  "sharing": "TLP:CLEAR",
  "signature": {
    "banner_strings": [],
    "field_keys": [
      "antivirus",
      "cpu",
      "date",
      "external ip",
      "gateway ip",
      "gpu",
      "internal ip",
      "language",
      "power",
      "ram",
      "screen",
      "system"
    ],
    "filenames": [
      "information.txt"
    ],
    "panel_brand": null
  },
  "status": "active"
}
