{
  "$schema": "../../../schemas/fingerprint.schema.json",
  "family_id": "unattributed-c73ec9aca1bf8eafc73c082b1c47bbea",
  "id": "fp_7e0768e3b26835c7182a14449dc9be9b",
  "quality": {
    "independent_signal_count": 2,
    "independent_signal_types": [
      "field_keys",
      "filenames"
    ],
    "yara_eligible": false
  },
  "schema_version": "1.0",
  "scope": "exported_log_format",
  "sharing": "TLP:CLEAR",
  "signature": {
    "banner_strings": [],
    "field_keys": [
      "country",
      "ip address",
      "time",
      "user",
      "user name"
    ],
    "filenames": [
      "info.txt"
    ],
    "panel_brand": null
  },
  "status": "active"
}
