{
  "$schema": "../../../schemas/fingerprint.schema.json",
  "family_id": "white-snake",
  "id": "fp_4dbdd0443cb1168b526890c676f4df87",
  "quality": {
    "independent_signal_count": 2,
    "independent_signal_types": [
      "field_keys",
      "filenames"
    ],
    "yara_eligible": false
  },
  "schema_version": "1.0",
  "scope": "exported_log_format",
  "sharing": "TLP:CLEAR",
  "signature": {
    "banner_strings": [],
    "field_keys": [
      "city",
      "country",
      "cpu",
      "gpu",
      "hwid",
      "installed antivirus",
      "internet provider",
      "ip",
      "ram",
      "region",
      "started as admin",
      "system",
      "system time",
      "user name"
    ],
    "filenames": [
      "pc_info.txt"
    ],
    "panel_brand": null
  },
  "status": "active"
}
