{
  "$schema": "../../../schemas/fingerprint.schema.json",
  "family_id": "unattributed-a854c167c0b2ce12d2ee89b3103aaa1d",
  "id": "fp_637927024fc7b01bcfdef435f5c4fad8",
  "quality": {
    "independent_signal_count": 2,
    "independent_signal_types": [
      "field_keys",
      "filenames"
    ],
    "yara_eligible": false
  },
  "schema_version": "1.0",
  "scope": "exported_log_format",
  "sharing": "TLP:CLEAR",
  "signature": {
    "banner_strings": [],
    "field_keys": [
      "arch",
      "count core",
      "file location",
      "ip address",
      "release",
      "type",
      "user info"
    ],
    "filenames": [
      "information.txt",
      "system.txt"
    ],
    "panel_brand": null
  },
  "status": "active"
}
