{
  "$schema": "../../../schemas/fingerprint.schema.json",
  "family_id": "unattributed-37d96012a931c28dc2e657acb9d7f9cf",
  "id": "fp_fa7d3bef54c73fd73779d6499206ed32",
  "quality": {
    "independent_signal_count": 2,
    "independent_signal_types": [
      "field_keys",
      "filenames"
    ],
    "yara_eligible": false
  },
  "schema_version": "1.0",
  "scope": "exported_log_format",
  "sharing": "TLP:CLEAR",
  "signature": {
    "banner_strings": [],
    "field_keys": [
      "computer",
      "disk capacity",
      "disk free",
      "memory",
      "os",
      "user"
    ],
    "filenames": [
      "system_info.txt"
    ],
    "panel_brand": null
  },
  "status": "active"
}
