{
  "$schema": "../../../schemas/fingerprint.schema.json",
  "family_id": "redline",
  "id": "fp_58def11db6c7e41c1cc58077791298c8",
  "quality": {
    "independent_signal_count": 2,
    "independent_signal_types": [
      "field_keys",
      "filenames"
    ],
    "yara_eligible": false
  },
  "schema_version": "1.0",
  "scope": "exported_log_format",
  "sharing": "TLP:CLEAR",
  "signature": {
    "banner_strings": [],
    "field_keys": [
      "anti-viruses",
      "build id",
      "country",
      "current language",
      "hwid",
      "ip",
      "location",
      "log date",
      "name",
      "operation system",
      "process elevation",
      "timezone",
      "uac",
      "zip code"
    ],
    "filenames": [
      "userinformation.txt"
    ],
    "panel_brand": null
  },
  "status": "active"
}
