{
  "$schema": "../../../schemas/fingerprint.schema.json",
  "family_id": "s-hub-stealer",
  "id": "fp_3c9de3aed18ee8c9eea55db6117edbc8",
  "quality": {
    "independent_signal_count": 3,
    "independent_signal_types": [
      "marker",
      "field_keys",
      "filenames"
    ],
    "yara_eligible": true
  },
  "schema_version": "1.0",
  "scope": "exported_log_format",
  "sharing": "TLP:CLEAR",
  "signature": {
    "banner_strings": [],
    "field_keys": [
      "build tag",
      "external ip",
      "graphics/displays",
      "hardware",
      "password",
      "software"
    ],
    "filenames": [
      "information.txt"
    ],
    "panel_brand": "SHub Stealer"
  },
  "status": "active"
}
