{
  "$schema": "../../../schemas/fingerprint.schema.json",
  "family_id": "unattributed-73cbe0e25ff801f69d3be8d46354c47d",
  "id": "fp_54078a6d61752ef02e525780e42d28b0",
  "quality": {
    "independent_signal_count": 2,
    "independent_signal_types": [
      "field_keys",
      "filenames"
    ],
    "yara_eligible": false
  },
  "schema_version": "1.0",
  "scope": "exported_log_format",
  "sharing": "TLP:CLEAR",
  "signature": {
    "banner_strings": [],
    "field_keys": [
      "computer",
      "cpu",
      "gpu",
      "os",
      "ram",
      "resolution",
      "user"
    ],
    "filenames": [
      "system_info.txt"
    ],
    "panel_brand": null
  },
  "status": "active"
}
