{
  "$schema": "../../../schemas/fingerprint.schema.json",
  "family_id": "unattributed-b0c832ea09ce07424887ad66a57dafb5",
  "id": "fp_376662fcd8ae73a0f2eca1a55bebe56a",
  "quality": {
    "independent_signal_count": 2,
    "independent_signal_types": [
      "field_keys",
      "filenames"
    ],
    "yara_eligible": false
  },
  "schema_version": "1.0",
  "scope": "exported_log_format",
  "sharing": "TLP:CLEAR",
  "signature": {
    "banner_strings": [],
    "field_keys": [
      "cpu",
      "disk",
      "display resolution",
      "gpu",
      "installed software",
      "keyboard languages",
      "os",
      "process",
      "ram",
      "uid"
    ],
    "filenames": [
      "_information.txt"
    ],
    "panel_brand": null
  },
  "status": "active"
}
