{
  "$schema": "../../../schemas/fingerprint.schema.json",
  "family_id": "unattributed-bf573ab805533e1940dc2c28daa3fc80",
  "id": "fp_a85c558899b31bc3761affd18eb54d08",
  "quality": {
    "independent_signal_count": 2,
    "independent_signal_types": [
      "field_keys",
      "filenames"
    ],
    "yara_eligible": false
  },
  "schema_version": "1.0",
  "scope": "exported_log_format",
  "sharing": "TLP:CLEAR",
  "signature": {
    "banner_strings": [],
    "field_keys": [
      "city",
      "country",
      "ip",
      "isp",
      "org",
      "os",
      "processor",
      "region",
      "user"
    ],
    "filenames": [
      "system_info.txt"
    ],
    "panel_brand": null
  },
  "status": "active"
}
