{
  "$schema": "../../../schemas/fingerprint.schema.json",
  "family_id": "raccoon",
  "id": "fp_793567a050755f9bf2861ce6fc632294",
  "quality": {
    "independent_signal_count": 2,
    "independent_signal_types": [
      "field_keys",
      "filenames"
    ],
    "yara_eligible": false
  },
  "schema_version": "1.0",
  "scope": "exported_log_format",
  "sharing": "TLP:CLEAR",
  "signature": {
    "banner_strings": [],
    "field_keys": [
      "build",
      "build compile date",
      "ip info",
      "locale",
      "system information",
      "user id"
    ],
    "filenames": [
      "system info.txt"
    ],
    "panel_brand": null
  },
  "status": "active"
}
