{
  "$schema": "../../../schemas/fingerprint.schema.json",
  "family_id": "vidar",
  "id": "fp_edae11705baf127a4ae5b2aa45528a44",
  "quality": {
    "independent_signal_count": 2,
    "independent_signal_types": [
      "field_keys",
      "filenames"
    ],
    "yara_eligible": false
  },
  "schema_version": "1.0",
  "scope": "exported_log_format",
  "sharing": "TLP:CLEAR",
  "signature": {
    "banner_strings": [],
    "field_keys": [
      "av",
      "computer name",
      "country",
      "date",
      "display resolution",
      "guid",
      "hwid",
      "install date",
      "ip",
      "keyboard languages",
      "local time",
      "path",
      "processor",
      "ram",
      "timezone",
      "user name",
      "windows",
      "work dir"
    ],
    "filenames": [
      "information.txt",
      "system.txt",
      "systeminfo.txt"
    ],
    "panel_brand": null
  },
  "status": "active"
}
