{
  "$schema": "../../../schemas/fingerprint.schema.json",
  "family_id": "crypt-bot",
  "id": "fp_cea640c59941fcc39cdb00af2aaae54c",
  "quality": {
    "independent_signal_count": 2,
    "independent_signal_types": [
      "field_keys",
      "filenames"
    ],
    "yara_eligible": false
  },
  "schema_version": "1.0",
  "scope": "exported_log_format",
  "sharing": "TLP:CLEAR",
  "signature": {
    "banner_strings": [],
    "field_keys": [
      "cpu",
      "display resolution",
      "gpu",
      "installed software",
      "keyboard languages",
      "os",
      "ram"
    ],
    "filenames": [
      "_information.txt"
    ],
    "panel_brand": null
  },
  "status": "active"
}
